{
  "schemaVersion": 1,
  "id": "trainwreck-s1",
  "status": "review",
  "name": "TrainWreck S1",
  "jp": null,
  "aliases": [],
  "classification": {
    "type": "unknown"
  },
  "breeding": {
    "generation": "S1",
    "method": "selfed"
  },
  "lineage": {
    "status": "confirmed",
    "confidence": "A",
    "basis": "breederOfficial",
    "sourceRefs": [
      "humboldt-csi-trainwreck-s1"
    ],
    "display": "TrainWreck × TrainWreck",
    "parents": [
      "TrainWreck"
    ],
    "note": "Humboldt CSI's official product page identifies TrainWreck S1 as TrainWreck × TrainWreck; together with the S1 designation this is treated as a selfed S1 line."
  },
  "relations": [
    {
      "entityId": "humboldt-csi",
      "roles": [
        "breeder",
        "seedCompany"
      ],
      "status": "confirmed",
      "confidence": "A",
      "basis": "breederOfficial",
      "sourceRefs": [
        "humboldt-csi-trainwreck-s1"
      ]
    }
  ],
  "aromas": {
    "status": "unknown",
    "items": [],
    "note": "No cultivar-wide aroma claim is added beyond the official source."
  },
  "terpenes": {
    "status": "unknown",
    "items": [],
    "note": "No cultivar-specific lot terpene profile or COA is used for this S1 entry."
  },
  "origin": {
    "status": "unknown",
    "text": "",
    "note": "The official page does not establish a sufficiently bounded creation location for this S1 line; no location is inferred."
  },
  "history": {
    "status": "confirmed",
    "confidence": "B",
    "basis": "breederOfficial",
    "sourceRefs": [
      "humboldt-csi-trainwreck-s1"
    ],
    "text": "Humboldt CSI states that the mid-to-late-1990s TrainWreck clone has been preserved in its library for over 20 years and is now available in S1 form.",
    "note": "The official page provides bounded parent-clone preservation context; no unsupported chronology is added."
  },
  "visuals": [
    {
      "role": "primary",
      "src": "strains/trainwreck-s1/images/generated/primary.webp",
      "alt": "TrainWreck S1の根拠範囲を明示したAI生成の植物学的参考ビジュアル",
      "rights": "AI-generated project asset for Cannabis Strain Wisdom. No official or third-party image is copied or stored; only bounded morphology evidence is used.",
      "scope": "cultivar",
      "aiGenerated": true,
      "sourceType": "aiGenerated"
    }
  ],
  "checkedAt": "2026-08-19",
  "updatedAt": "2026-08-19"
}
