{"schemaVersion":1,"id":"shaman","status":"review","name":"Shaman","jp":null,"aliases":["Shaman®"],"classification":{"type":"sativa-dominant-hybrid"},"breeding":{"generation":"F1","method":"Purple #1 male × early Skunk female; offered as regular and feminised seed"},"lineage":{"status":"confirmed","confidence":"A","basis":"breederOfficial","sourceRefs":["dutch-passion-shaman","dutch-passion-shaman-story"],"display":"Purple #1 × Skunk","parents":["Purple #1","Skunk"],"note":"Dutch Passion's current history page specifies a Purple #1 male crossed with an exceptional early Skunk female and identifies the result as a sativa-dominant F1 hybrid."},"relations":[{"entityId":"dutch-passion","roles":["breeder","seedCompany"],"status":"confirmed","confidence":"A","basis":"breederOfficial","sourceRefs":["dutch-passion-shaman","dutch-passion-shaman-story"]}],"aromas":{"status":"confirmed","confidence":"A","basis":"breederOfficial","sourceRefs":["dutch-passion-shaman"],"items":["fresh","sweet","fruity","floral","spicy","sour","pine","woody"],"note":"Official product description calls the aroma fresh, sweet and spicy; more specifically sweet, fruity, floral and spicy, with sour/pine and sometimes woody notes across phenotypes."},"terpenes":{"status":"unknown","items":[],"note":"Dutch Passion uses sensory 'terpene profile' descriptors such as spicy/herbal and aroma terms, but the reviewed official sources do not identify a compound-level terpene composition. No compounds are inferred."},"origin":{"status":"confirmed","confidence":"A","basis":"breederOfficial","sourceRefs":["dutch-passion-shaman-story"],"text":"The Netherlands; Dutch Passion outdoor breeding program","note":"Official history states Shaman originated in Dutch Passion's outdoor breeding program and was selected over years under Dutch outdoor conditions."},"history":{"status":"confirmed","confidence":"A","basis":"breederOfficial","sourceRefs":["dutch-passion-shaman-story"],"text":"Developed through years of outdoor selection in the Netherlands from Purple #1 × early Skunk.","note":"Dutch Passion describes decades of Dutch outdoor/greenhouse selection for the cultivar."},"visuals":[],"checkedAt":"2026-08-17","updatedAt":"2026-08-17"}