{
  "schemaVersion": 1,
  "id": "gorilla-glue-4-s1",
  "status": "review",
  "name": "Gorilla Glue 4 S1",
  "jp": null,
  "aliases": [],
  "classification": {
    "type": "unknown"
  },
  "breeding": {
    "generation": "S1",
    "method": "selfed"
  },
  "lineage": {
    "status": "confirmed",
    "confidence": "A",
    "basis": "breederOfficial",
    "sourceRefs": [
      "humboldt-csi-gorilla-glue-4-s1"
    ],
    "display": "Gorilla Glue 4 × Gorilla Glue 4",
    "parents": [
      "Gorilla Glue 4"
    ],
    "note": "Humboldt CSI's official Gorilla Glue 4 S1 page lists the cultivar as Gorilla Glue 4 × Gorilla Glue 4. Together with the official S1 designation, this is treated as a selfed S1 line. No unstated ancestry is copied from the parent cultivar."
  },
  "relations": [
    {
      "entityId": "humboldt-csi",
      "roles": [
        "breeder",
        "seedCompany"
      ],
      "status": "confirmed",
      "confidence": "A",
      "basis": "breederOfficial",
      "sourceRefs": [
        "humboldt-csi-gorilla-glue-4-s1"
      ]
    }
  ],
  "aromas": {
    "status": "unknown",
    "items": [],
    "note": "The official Gorilla Glue 4 S1 product page does not provide cultivar-level aroma descriptors; parent-cultivar or customer-review aromas are not generalized to this S1 line."
  },
  "terpenes": {
    "status": "unknown",
    "items": [],
    "note": "The official Gorilla Glue 4 S1 product page does not provide a cultivar-specific terpene profile or lot COA."
  },
  "origin": {
    "status": "unknown",
    "text": "",
    "note": "The official Gorilla Glue 4 S1 product page does not state the S1 line's exact creation location; no inferred location is added."
  },
  "history": {
    "status": "unknown",
    "text": "",
    "note": "The official Gorilla Glue 4 S1 product page does not state a cultivar-specific release date or development history; no secondary history is imported."
  },
  "visuals": [
    {
      "role": "primary",
      "src": "strains/gorilla-glue-4-s1/images/generated/primary.webp",
      "alt": "Gorilla Glue 4 S1の公式S1同定情報を基礎に、未確認の品種固有形態を付加せず作成するAI生成の植物学的参考ビジュアル",
      "rights": "AI-generated project asset for Cannabis Strain Wisdom. No third-party image is copied; the prompt is constrained to claims supported by the cited official cultivar page.",
      "scope": "cultivar",
      "aiGenerated": true,
      "sourceType": "aiGenerated"
    }
  ],
  "checkedAt": "2026-08-19",
  "updatedAt": "2026-08-19"
}
